{
  "$schema": "http://json-schema.org/draft-07/schema#",
  "title": "AgentDefinition",
  "type": "object",
  "required": ["id", "name", "role", "scope", "capabilities", "inputs", "outputs", "kpis", "security_profile"],
  "properties": {
    "id": {
      "type": "string",
      "description": "Unique identifier for the agent (e.g., 'agent_ceo', 'agent_security')."
    },
    "name": {
      "type": "string",
      "description": "Human-readable name of the agent."
    },
    "role": {
      "type": "string",
      "description": "High-level role description (e.g., 'Primary CEO Agent', 'Security & Threat Analysis Agent')."
    },
    "scope": {
      "type": "string",
      "description": "Domain of responsibility and boundaries of this agent."
    },
    "capabilities": {
      "type": "array",
      "items": { "type": "string" },
      "description": "List of core functions this agent can perform."
    },
    "inputs": {
      "type": "array",
      "items": { "type": "string" },
      "description": "Types of inputs this agent expects (e.g., 'customer_message', 'transaction_record')."
    },
    "outputs": {
      "type": "array",
      "items": { "type": "string" },
      "description": "Types of outputs this agent produces (e.g., 'draft_email', 'security_alert')."
    },
    "dependencies": {
      "type": "array",
      "items": { "type": "string" },
      "description": "IDs of other agents this agent depends on (e.g., 'agent_security')."
    },
    "kpis": {
      "type": "array",
      "items": {
        "type": "object",
        "required": ["name", "description", "metric_type"],
        "properties": {
          "name": { "type": "string" },
          "description": { "type": "string" },
          "metric_type": { "type": "string" },
          "target_value": {},
          "calculation_notes": { "type": "string" }
        }
      },
      "description": "Key performance indicators for this agent."
    },
    "security_profile": {
      "type": "object",
      "required": ["sensitivity_level", "requires_security_review", "allowed_data_types"],
      "properties": {
        "sensitivity_level": {
          "type": "string",
          "enum": ["LOW", "MEDIUM", "HIGH", "CRITICAL"],
          "description": "How sensitive the data handled by this agent is."
        },
        "requires_security_review": {
          "type": "boolean",
          "description": "Whether outputs must be reviewed by the Security Agent."
        },
        "allowed_data_types": {
          "type": "array",
          "items": { "type": "string" },
          "description": "Whitelisted data categories this agent may access."
        }
      }
    },
    "configuration": {
      "type": "object",
      "description": "Implementation-specific configuration (e.g., tools, APIs, rate limits)."
    },
    "notes": {
      "type": "string",
      "description": "Additional human-readable notes about this agent."
    }
  }
}
