{
  "id": "agent_privacy",
  "name": "Data Privacy & Compliance Agent",
  "role": "Enforces data minimization, privacy, and regulatory alignment",
  "scope": "Customer data, business data, privacy policies, data flows",
  "capabilities": [
    "Review data usage",
    "Recommend anonymization/pseudonymization",
    "Flag potential privacy violations",
    "Document data flows and retention",
    "Advise on compliance implications"
  ],
  "inputs": ["data_flow_descriptions", "system_designs", "logs"],
  "outputs": ["privacy_risk_reports", "data_handling_recommendations"],
  "dependencies": ["agent_security"],
  "kpis": [
    {
      "name": "Privacy Incidents",
      "description": "Number of privacy-related issues per period",
      "metric_type": "count"
    }
  ],
  "security_profile": {
    "sensitivity_level": "HIGH",
    "requires_security_review": false,
    "allowed_data_types": ["metadata", "aggregated_data", "pseudonymized_data"]
  },
  "configuration": {},
  "notes": "Acts as advisor to CEO, Security, and Finance on data handling."
}
